{
  "id": "search/grep",
  "family": "search",
  "description": "Compact grep output while preserving matching lines.",
  "match": {
    "toolNames": ["exec"],
    "argv0": ["grep"]
  },
  "transforms": {
    "stripAnsi": true,
    "dedupeAdjacent": true,
    "trimEmptyEdges": true
  },
  "summarize": {
    "head": 12,
    "tail": 4
  },
  "failure": {
    "preserveOnFailure": true,
    "head": 16,
    "tail": 10
  },
  "counters": [
    {
      "name": "match",
      "pattern": ".+:.+"
    }
  ]
}
